{
  "$schema": "http://json-schema.org/draft-07/schema#",
  "title": "App directory site configuration",
  "type": "object",
  "additionalProperties": false,
  "required": ["title", "catalogues", "repositoryRoots", "output"],
  "properties": {
    "$schema": { "type": "string" },
    "title": { "type": "string", "minLength": 1, "pattern": "\\S" },
    "description": { "type": "string", "minLength": 1 },
    "author": { "type": "string", "minLength": 1 },
    "authorUrl": { "type": "string", "format": "web-url" },
    "url": { "type": "string", "format": "web-url" },
    "repositoryRoots": { "type": "array", "uniqueItems": true, "items": { "type": "string", "minLength": 1 } },
    "catalogues": { "type": "array", "uniqueItems": true, "items": { "type": "string", "minLength": 1 } },
    "output": { "type": "string", "minLength": 1 },
    "carnivalPrize": {
      "description": "Optional prize for the carnival's hidden high striker game: an invite minted by a Manors & Menaces giveaway endpoint.",
      "type": "object",
      "additionalProperties": false,
      "required": ["name", "endpoint"],
      "properties": {
        "name": { "type": "string", "minLength": 1, "pattern": "\\S" },
        "endpoint": { "type": "string", "format": "web-url" },
        "riddle": {
          "description": "Optional riddle the game shows: the order of five monsters to scare before claiming. Never write the plain answer here.",
          "type": "string", "minLength": 1, "maxLength": 500, "pattern": "\\S"
        }
      }
    }
  }
}
