{
  "$schema": "../schema/site.schema.json",
  "title": "Apps by L-K-M",
  "description": "Desktop utilities, creative tools, and browser games by L-K-M.",
  "author": "L-K-M",
  "authorUrl": "https://github.com/L-K-M",
  "repositoryRoots": ["/repositories"],
  "catalogues": ["/app/catalogue"],
  "output": "/site/public"
}
