{
  "$schema": "./schema/site.schema.json",
  "title": "Cabinet of Curiosities",
  "description": "A cabinet of desktop utilities, creative tools, and browser games by L-K-M.",
  "author": "L-K-M",
  "authorUrl": "https://github.com/L-K-M",
  "repositoryRoots": [".."],
  "catalogues": ["catalogue"],
  "output": "dist"
}
